IdMin,IdMax,Index,TableOffset,Text 
3000,3070,3000,6808,"Elementary sorcery. Fire soul arrow. Soul arrows inflict magic damage, making them effective against iron armor, tough scales, and other physically resilient materials."
3000,3070,3010,7148,"Sorcery which improves upon Soul Arrow. Fire strong soul arrow. At the Vinheim Dragon School, the acquisition of this spell marks an apprentice's coronation as a sorcerer. "
3000,3070,3020,7496,"Soul sorcery emphasizing power. Fire heavy soul arrow. A more powerful, but also slower sorcery. Difficult to use due to a long cool down and a limitation on the number of castings."
3000,3070,3030,7862,"Sorcery which improves upon Heavy Soul Arrow. Fire strong heavy soul arrow. As difficult to use as Heavy Soul Arrow, but powerful enough to make it well worth it. Adored by certain sorcerers."
3000,3070,3040,8248,"Sorcery developed by Big Hat Logan. Fire homing soulmass. Life originates in the soul; no wonder the soulmass draws toward it. This sorcery is a window into seeker Logan's methods."
3000,3070,3050,8612,"Sorcery boosted by the knowledge. Logan acquired at the Regal Archives. Fire homing crystal soulmass. The mysteries of souls, crystals, and the sorceries are deeply intertwined."
3000,3070,3060,8970,"Sorcery developed by Big Hat Logan. Fire piercing soul spear. A symbol of Logan's strength, the soul spear is referenced repeatedly in the legends, and is said to be on par with Lord Gwyn's lightning."
3000,3070,3070,9374,"Sorcery boosted by the knowledge. Logan acquired at the Regal Archives. Fire piercing crystal soul spear. These pale magic spears, sharpened through crystallization, are on par with the armaments of the ancient lords."
3100,3120,3100,9812,"Sorcery for casters who wield swords. Magic augmentation: right weapon. The power of the magic swordsmen of Vinheim is predicated upon this and Magic Shield. Many warriors learn sorcery just for this."
3100,3120,3110,10216,"Sorcery which improves upon Magic Weapon. High magic augmentation: right weapon. At Vinheim Dragon School, only magic swordsmen on special orders are allowed to learn this spell which grants powerful augmentation to various weapons."
3100,3120,3120,10684,"Sorcery boosted by the knowledge. Logan acquired at the Regal Archive. High magic + crystallization: right weapon Logan's trials were successful, and the crystal medium facilitated a stronger bond between weapon and soul."
3300,3310,3300,11130,"Sorcery for casters who wield swords. Magic augmentation: left shield. Shields augmented by magic are resistant to magic attacks and have higher stability. This spell makes it possible to challenge powerful foes with a small shield."
3300,3310,3310,11598,"Sorcery which improves upon Magic Shield. High magic augmentation: left shield. At Vinheim Dragon School, only magic swordsmen on special orders are allowed to learn this spell which grants temporary strength to greatshields."
3400,3410,3400,12052,"Ancient sorcery of the lost land of Oolacile. Turns right weapon invisible. Not a simple augmentation, making it dependent on the skill of its caster.  An example of the capacity of Oolacile sorceries to control light."
3400,3410,3410,12492,"Ancient sorcery of the lost land of Oolacile. Turns body nearly invisible. Although perfect invisibility is unachievable due to the risk of dissipation, the caster need only stand still for a moment to blend in to environs with astounding camouflage.  "
3500,3550,3500,13004,"Ancient sorcery of the lost land of Oolacile. Cast a bright light upon surroundings. This light-producing sorcery is elementary but nonetheless demonstrates the achievements in mysticism of Oolacile. Such magic has not been developed even in Vinheim."
3500,3550,3510,13508,"Sorcery developed by a certain surreptitious sorcerer at Vinheim Dragon School. Masks all noises of caster. Effectively, Vinheim is controlled by the Dragon School, and it is no wonder that the town has its share of dark secrets."
3500,3550,3520,13970,"Sorcery used by playful sorcerers. Lure enemies away by creating a sound originating in the distance. This spell is not the first choice for serious sorcerers, but it has a surprising amount of applications, some of them extremely effective. "
3500,3550,3530,14458,"Ancient sorcery of the lost land of Oolacile. Repair equipped weapons and armor. This sorcery was a part of everyday life in Oolacile. Its effects resemble Repair Powder, which must have found its way into the culture of this lost land. "
3500,3550,3540,14936,"Sorcery developed by a certain surreptitious sorcerer at Vinheim Dragon School. Reduce damage and noise from fall. This sorcery, along with Hush, explains the extravagant cost of hiring Vinheim spooks.  "
3500,3550,3550,15348,"Ancient sorcery of the lost land of Oolacile. Transform into something inconspicuous. A separate stealth spell from Hidden Body. A skilled stealth sorcerer must be aware of his or her surroundings and of which objects are prime candidates for imitation. "
3600,3610,3600,15860,"Sorcery of the red-robed remedician. Ingward, guardian of the seal in New Londo Sacrifice humanity to undo curse. Abhorrent curses eat away at the core of one's very existence, and cleansing oneself of curses is no easy task indeed."
3600,3610,3610,16328,"Sorcery of the red-robed Yulva, one of the Sealers of New Londo. Reduce bleeding and poison build-up, and undo various poisonous effects. One of New Londo's unique healing sorceries. Perhaps she abandoned her Sealer duty to take her healing arts back to Blighttown."
3700,3700,3700,16862,"Sorcery developed by Logan during his infatuation with Seath the Scaleless. Emit crystal breath of Seath the Scaleless. Although it no longer causes curses, what madness caused old Big Hat to appropriate this frightful power of the ancient dragons?"
4000,4060,4000,17362,"Standard pyromancy of the Great Swamp. Hurl fireball. The fire damage caused by fireballs makes them effective against corporeal beasts and Undead, who by nature fear flame."
4000,4060,4010,17712,"Pyromancy which improves upon Fireball. Hurl fire orb. The flaming fire orb explodes upon impact, causing fire splash damage in a spectacle which seems to symbolize the strength of the fire-manipulating pyromancers."
4000,4060,4020,18146,"Ultimate fireball pyromancy. Hurl giant fireball. Salaman the Master Pyromancer, also called the Great Fireball after this spell, believed pyromancy was rooted in an adoration of fire. Those who acquire this spell usually agree. "
4000,4060,4030,18610,"Primal pyromancy taught by Quelana of Izalith. Erect fire pillars in vicinity. The storm of flame is indiscriminate, and incinerates all nearby life."
4000,4060,4040,18912,"Primal pyromancy of Quelana of Izalith. Erect giant fire pillars in vicinity. The tempestuous raging flames resemble those summoned by the Daughters of Chaos when they challenged the ancient dragons and scorched the very earth."
4000,4060,4050,19370,"Pyromancy foreign to the Great Swamp. Create a surge of flame from palm of hand. Not all pyromancy originates in the Great Swamp. One hears rumors of unknown pyromancers inhabiting various lands, and this spell is the work of one such outlander."
4000,4060,4060,19864,"Primal pyromancy taught by Quelana of Izalith. Sweep foes with fire whip. The root pyromancy of Combustion, but much more difficult to wield."
4100,4110,4100,20150,"Elementary pyromancy. Create powerful flame in hand. One of the most basic pyromancies. For this very reason, the flame thus created is fierce."
4100,4110,4110,20440,"Pyromancy which improves upon Combustion. Create powerful, giant flame in hand. Great Combustion creates a powerful flame, but many sorcerers mock the simplicity of this spell."
4200,4220,4200,20796,"Unique pyromancy crafted by Eingyi, considered a heretic even at the Great Swamp Create poison mist. Eingyi became an egg-bearing Undead who serves a deformed young girl who speaks an unintelligible tongue."
4200,4220,4210,21212,"Unique pyromancy crafted by Eingyi, considered a heretic even at the Great Swamp Create intense poison mist. Why was Eingyi driven from the Great Swamp? One only need cast this pyromancy, a perverse diversion from the art of fire, to find out."
4200,4220,4220,21702,"Pyromancy foreign to the Great Swamp. Emit acid which corrodes weapons and armor. Not all pyromancy originates in the Great Swamp. One hears rumors of unknown pyromancers inhabiting various lands, and this spell is the work of one such outlander."
4300,4320,4300,22198,"Pyromancy of Carmina, who harnessed the power of flame to actualize the inner-self. Iron flesh boosts defense and resilience. Use of this pyromancy requires caution, as the caster becomes exceedingly heavy and unable to move freely."
4300,4320,4310,22666,"Pyromancy of Carmina, who harnessed the power of flame to actualize the inner-self. Intense sweating reduces flame damage. Carmina, the most accomplished pupil of Salaman the Master Pyromancer, pioneered new directions for the art of pyromancy."
4360,4360,4360,23158,"Advanced pyromancy of Quelana of Izalith. Charm Undead and gain temporary allies. The living are lured by flame, and this relationship is part and parcel to the art of pyromancy. Can be used by either gender."
4400,4400,4400,23578,"Pyromancy of Carmina, who harnessed the power of flame to actualize the inner-self. Short strength/endurance boost, but lose HP. Excessive power eats away the life-force of its caster, and like all dangerous spells, Power Within was kept secret for eons."
4500,4520,4500,24090,"Art of the Flame of Chaos, which engulfed the Witch of Izalith and her daughters. Hurl giant chaos fireball, which changes strength depending on humanity. The Flame of Chaos can melt stone, producing a short-lived lava glob."
4500,4520,4510,24542,"Art of the Flame of Chaos, which engulfed the Witch of Izalith and her daughters. Erect localized chaos fire pillars which change strength depending on humanity. The Witch of Izalith, in an ambitious attempt to copy the First Flame, created instead the Flame of Chaos, a twisted bed of life."
4500,4520,4520,25128,"Art of the Flame of Chaos, which engulfed the Witch of Izalith and her daughters. Sweep foes with chaos fire whip which changes strength depending on humanity. The fire whip was wielded by the eldest of the Daughters of Chaos."
5000,5050,5000,25584,"Elementary miracle cast by clerics. Restores HP. To cast a miracle, the caster learns a tale of the Gods, and says a prayer to be blessed by its revelations. Heal is the shortest of such miraculous tales."
5000,5050,5010,25996,"Great miracle cast by advanced clerics. Restores high HP. Great Heal is a long tale, only learned by a select few. No caster will be disappointed by the bountiful life that it yields."
5000,5050,5020,26366,"Great miracle cast by advanced clerics. Restores high HP. Great Heal Excerpt borrows from only several verses of Great Heal. As a result, it can only be cast a stark few times."
5000,5050,5030,26722,"Special miracle granted to the maidens of Gwynevere, Princess of the Sun. Restores high HP for self and vicinity. The miracles of Gwynevere, the princess  cherished by all, grant their blessing to a great many warriors."
5000,5050,5040,27164,"Common miracle amongst cleric knights. Gradual HP restoration. Beware of the cleric knight blessed by Replenishment, for he shall not fall easily."
5000,5050,5050,27460,"Special miracle granted to the maidens of Gwynevere, Princess of the Sun. Gradual HP restoration for self and vicinity. The miracles of Gwynevere, the princess  cherished by all, grant their blessing to a great many warriors."
5100,5110,5100,27914,"Miracle known only by the servants of the first dead, Gravelord Nito. Giant Gravelord swords jut out in vicinity. Nito sleeps deep within the Giant Catacombs, quietly overseeing all death, and waiting for his servants to usher in the Eye of Death."
5100,5110,5110,28412,"Miracle known only by the servants of the first dead, Gravelord Nito. Giant Gravelord swords jut out in vicinity. Many have died, and many eyes were claimed to realize the Greatsword Dance, a Gravelord ritual known only by his closest servants."
5200,5210,5200,28904,"Lost miracle, foreign to the Way of White While active, no losses incurred upon death The Way of White recognizes death itself, but admonishes the Undead. It is for this very reason that this miracle was lost."
5200,5210,5210,29326,"Great miracle cast by advanced clerics. Return to last bonfire rested at. Would normally link to one's homeland, only the curse of the Undead has distorted its power, redirecting casters to a bonfire. Or perhaps for Undead, this serves as home? "
5300,5320,5300,29820,"Common miracle amongst cleric knights. Create shockwave. This quickly-acting miracle inflicts no damage, but propels foes back and defends against arrows. Cleric knights use this miracle when charging into enemy mobs.  "
5300,5320,5310,30266,"Primal form of Force. Create powerful shockwave. Wrath of the Gods was an epic tale that tattered over time and devolved into the modern Force. This primal form of Force emits a shockwave that also inflicts damage."
5300,5320,5320,30698,"Outland miracle, foreign to the Way of White. Emit shockwave. Considered an alternate branching of Force. Emits an expanding shockwave orb."
5400,5400,5400,30980,"Miracle of clerics on an Undead mission. Display more guidance from other worlds. Guidance facilitates communication between Undead, but their value varies greatly. A balance of faith and wisdom is required."
5500,5520,5500,31398,"Miracle passed down to those bound by the Warrior of Sunlight covenant. Hurl lightning spear. Lightning spears inflict rare lightning damage, and are very effective against magic, fire, and most of all, dragons."
5500,5520,5510,31824,"Miracle passed down to those bound by the Warrior of Sunlight covenant. Hurl giant lightning spear. The weapon of the God of War, who inherited the sunlight of Lord Gwyn, but had respect only for arms, and nothing else."
5500,5520,5520,32266,"Miracle born from the fading soul of Gwyn. Hurl sunlight spear. In the war that marked the dawn of the Age of Fire, Gwyn wielded these rays of sunlight, which remain fierce even as they fade."
5600,5610,5600,32652,"Miracle of Bishop Havel the Rock. Cover body in defensive magic coating. This coating greatly boosts magic defense, assisting warriors who must face the magic which Bishop Havel countered so proficiently."
5600,5610,5610,33064,"Miracle of Bishop Havel the Rock. Cover body in powerful def. magic coating. Havel the Rock, an old battlefield compatriot of Lord Gwyn, was the sworn enemy of Seath the Scaleless. He despised magic, and made certain to devise means of counteraction."
5700,5710,5700,33568,"Miracle of the black-haired witch Velka. Temporary auto counter vs. heavy damage. For each sin there is a punishment, and it is the task of Goddess Velka to define the sin, and mete out the punishment."
5800,5810,5800,33974,"Outland miracle, foreign to the Way of White. Slows all walking within effect area. This miracle is normally used to flee, as it slows walking but does not affect attacks, but nevertheless defines peace perfectly."
5800,5810,5810,34404,"Secret rite of the black-haired witch Velka. Prevents casting of magic within effect area. Velka, the Goddess of Sin, is a rogue deity, but she is versed in arts both new and old, and is considered to have a great range of influence even as gods are concerned."
5900,5910,5900,34928,"Miracle wielded by Lord Gwyn's firstborn. Boost right weapon with rays of Sun. The power of sunlight, manifested as lightning, is very effective against dragons. When the eldest son was stripped of his deific status, he left this on his father's coffin, perhaps as a final farewell."
5900,5910,5910,35496,"Miracle granted to those bound by covenant to Gwyndolin, Lord Gwyn's lastborn. Boost right weapon with rays of Darkmoon. The power of the rays of the Darkmoon are manifested in vengeance, and the deeper the animus, the more devastating the attack."
1200000,1200000,1200000,35994,"Variation of Soul Arrow developed by sorcerers of the Undead Legion of Farron. Fire a soul dart. Well known among the Farron sorceries, it is learned far and wide due to its ease of use."
1210000,1210000,1210000,36372,"Sorcery which improves upon Farron Dart. Fires a more powerful soul dart. Entrusted to the leader of the Legion's acolytes, and apparently a sorcery of his daughter, Heysel, that was refined by a Crystal Sage."
1300000,1300000,1300000,36794,"Elementary sorcery. Fires a soul arrow. To use sorceries, equip a staff and attune a sorcery at a bonfire."
1301000,1301000,1301000,37010,"Sorcery which improves upon Soul Arrow. Fires a more powerful soul arrow. Many sorceries inflict magic damage, making them effective against iron armor, tough scales, and other physically resilient materials."
1302000,1302000,1302000,37430,"Elementary, yet practical sorcery from long ago. Fires a heavy soul arrow. Offers greater power but slower casting time, entailing a vulnerability that makes this sorcery trickier to handle."
1303000,1303000,1303000,37814,"Sorcery which improves upon Heavy Soul Arrow. Fires a more powerful heavy soul arrow. Sorceries are a logical discipline; their strength influenced by the caster's intelligence."
1304000,1304000,1304000,38172,"Sorcery developed by Big Hat Logan, the great sorcerer who left the Dragon School in an age long past. Releases a homing soulmass. This sorcery may offer a clue as to what Logan sought, but further investigation suggests its attraction to living things mirrors the nature of the dark."
1305000,1305000,1305000,38746,"Sharpens Homing Soulmass via crystallization. Releases a homing crystal soulmass. Crystal soulmass has piercing qualities. According to the Crystal Sages, old Big Hat achieved enlightenment within the Regal Archives, where he came to find the quintessence of sorcery in the facets of a certain crystal."
1306000,1306000,1306000,39356,"Sorcery developed by Big Hat Logan, the great sorcerer who left the Dragon School in an age long past. Fires a soul spear. The spear boasts superior penetrating power, and is testament to Logan's strength in battle,"
1307000,1307000,1307000,39792,"Further sharpens Soul Spear via crystallization. Fires a piercing crystal soul spear.  According to the Crystal Sages, old Big Hat achieved enlightenment within the Regal Archives, where he came to find the quintessence of sorcery in the facets of a certain crystal."
1308000,1308000,1308000,40330,"Sorcery of Archdeacon Royce and his deacons, said to have been imparted to them by McDonnell of the Boreal Valley. Fires dark soul dregs. Souls which swell from the deep pursue their target, drawn towards life."
1309000,1309000,1309000,40756,"Sorcery which improves upon Deep Soul. Fires powerful darkened soul dregs. Archdeacon McDonnell, a sorcerer himself, delighted in the cathedral's stagnating souls. For him, they represented the glorious bedrock of this world."
1310000,1310000,1310000,41210,"Sorcery for casters who wield swords. Reinforces right weapon with magic. The power of the sorcerer-swordsmen of Vinheim is predicated upon this and Magic Shield. Many warriors learn sorcery just for this enchantment."
1311000,1311000,1311000,41648,"Sorcery which improves upon Magic Weapon. Greatly reinforces right weapon with magic. Only sorcerer-swordsmen with special duties are permitted the use of this spell. The azure blade is said to cut down heavily armored knights with ease."
1312000,1312000,1312000,42126,"Further sharpens Magic Weapon via crystallization. Reinforces right weapon with crystal. After much experimentation, Logan found the crystal medium facilitated a stronger bond between weapon and soul."
1330000,1330000,1330000,42530,"Sorcery for casters who wield swords. Reinforces left shield with magic. Shields augmented by magic have higher stability and damage absorption. Even the smallest of shields can be toughened considerably with the use of this spell."
1331000,1331000,1331000,42998,"Sorcery which improves upon Magic Shield. Greatly reinforces left shield with magic. Only sorcerer-swordsmen with special duties are permitted the use of this spell, which temporarily grants even the smallest of shields fortitude more akin to that of a greatshield."
1340000,1340000,1340000,43532,"Lost sorcery from Oolacile, land of ancient golden sorceries. Turns right weapon invisible. The weapon itself undergoes no inherent changes. Effective use of this, like any tool, perhaps, is reliant upon the ingenuity of its caster."
1341000,1341000,1341000,44000,"Lost sorcery from Oolacile, land of ancient golden sorceries. Turns body nigh on invisible. Although perfect invisibility is unachievable due to the risk of dissipation, the caster need only stand still for a moment to blend in to environs with astounding camouflage."
1350000,1350000,1350000,44538,"Lost sorcery from Oolacile, land of ancient golden sorceries. Casts a light to illuminate surroundings. This light-producing magic is elementary but nonetheless demonstrates the pure nature of golden sorceries; the likes of which have not been developed even at the Dragon School."
1351000,1351000,1351000,45102,"A sorcery that facilitates surreptitious activity. Reduces the sound made by its caster. The eastern land of Mirrah is not only the home of proud knights. There is also a traditional order of shadow knights, who quietly carry out unspeakable tasks."
1353000,1353000,1353000,45602,"Lost sorcery from Oolacile, land of ancient golden sorceries. Repairs equipped weapons and armor. Includes weapons with exhausted durability. While the effects of this spell are rather subtle, its foundations are a well-guarded secret. Light is time, and the reversal of its effects is a forbidden art."
1354000,1354000,1354000,46212,"Sorcery developed by a certain surreptitious sorcerer at Vinheim Dragon School. Masks noises of the caster and prevents fall damage. Their mastery of this sorcery alone allows Vinheim spooks to demand handsome payment for their services. "
1355000,1355000,1355000,46694,"Lost sorcery from Oolacile, land of ancient golden sorceries. Transforms into something inconspicuous. Far from formally developed, this magic was instead born from the mischief of a young girl who sought relief from the solitude of the woods at dusk."
1356000,1356000,1356000,47200,"Sorcery developed by a certain surreptitious sorcerer at Vinheim Dragon School. Distracts foes with a distant sound. The sound carries with it a strangely infectious resonance that may cause one to stray from their post and expose their back."
1370000,1370000,1370000,47690,"Sorcery of the deluded Consumed King Oceiros. Emits crystal breath of Seath the Scaleless. Crystal breath has piercing qualities. Seath's research seemed to strike a chord with old Big Hat who, in his mad, disrobed state, made divine works such as this, his own. Oceiros was no doubt edified by this."
1372000,1372000,1372000,48296,"Sorcery which improves upon Farron Dart. Fires a cascade of soul darts. Entrusted to the leader of the Legion's acolytes, and apparently a sorcery of his daughter, Heysel, that was refined by a Crystal Sage."
1373000,1373000,1373000,48714,"Unique sorcery developed by extraordinary preacher twins known as the Crystal Sages. Casts a cascade of small crystal soulmasses from above. Crystal soulmasses have piercing qualities. In a pact said to have been formed long ago, one of the Sages allied with the Undead Legion in order to train the sorcerers of Farron."
1374000,1374000,1374000,49358,"Sorcery developed primarily for sorcerer-swordsmen. Attacks with a greatsword formed from souls. The ephemeral blade only exists as an extension of the caster, but its power is said to rival that of physical greatswords. Even the most obstinate magic purists may resort to this spell in times of crisis."
1375000,1375000,1375000,49968,"Alteration of Soul Greatsword developed by sorcerers of the Undead Legion of Farron. The Legion has a tendency to emphasize speed over power, and this practical alteration of an existing sorcery is no exception."
1603000,1603000,1603000,50394,"A forbidden dark sorcery. Casts a dark manifestation of humanity. It appears to be an expression of envy, or perhaps love towards another, that will tenaciously pursue its target. Even if, like so many human desires, it amounts to nothing but misfortune."
1613000,1613000,1613000,50906,"A forbidden dark sorcery. Strikes with blade formed of humanity's darkness. Passed from mother to daughter, this blade was intended for both protection and as a means of taking one's own life. The young girl never swung it more than once."
1620000,1620000,1620000,51386,"Sorcery imparted by the first of the Scholars, when Lothric and the Grand Archives were but young. Fires a torrential volley of souls. The first of the Scholars doubted the linking of the fire, and was alleged to be a private mentor to the Royal Prince."
1651000,1651000,1651000,51898,"Lost sorcery from Oolacile, land of ancient golden sorceries. Distorts light in order to deflect magic. A closely-guarded light manipulation spell that contorts the very fabric of fundamental laws, negating magic by denying its claim to physicality. "
1740000,1740000,1740000,52402,"Highly dangerous sorcery employed by Dragon School spooks. Only taught to trusted members. Releases mercury that eats away at HP. Beware, as the caster is not immune to its effect. A body caught in the silent mercury cloud lies still, while the face twists in a tortured scream. The names of these learned sorcerers became feared for this gruesome spectacle."
2400000,2400000,2400000,53124,"Elementary pyromancy that is often the first learned. Hurls a fireball. To use pyromancies, equip a pyromancy flame and attune a pyromancy at a bonfire."
