IdMin,IdMax,Index,TableOffset,Text 
2001,2022,2001,2528,"KG_OK"
2001,2022,2002,2540,"KG_Cancel"
2001,2022,2003,2560,"KG_L_U"
2001,2022,2004,2574,"KG_L_D"
2001,2022,2005,2588,"KG_L_L"
2001,2022,2006,2602,"KG_L_R"
2001,2022,2007,2616,"KG_L_UD"
2001,2022,2008,2632,"KG_L_LR"
2001,2022,2009,2648,"KG_L_UDLR"
2001,2022,2010,2668,"KG_R_U"
2001,2022,2011,2682,"KG_R_L"
2001,2022,2012,2696,"KG_L1"
2001,2022,2013,2708,"KG_R1"
2001,2022,2014,2720,"KG_L2"
2001,2022,2015,2732,"KG_R2"
2001,2022,2016,2744,"KG_L3"
2001,2022,2017,2756,"KG_R3"
2001,2022,2018,2768,"KG_LS"
2001,2022,2019,2780,"KG_RS"
2001,2022,2020,2792,"KG_TP_L"
2001,2022,2021,2808,"KG_TP_R"
2001,2022,2022,2824,"KG_Start"
2100,2100,2100,2842,"Gamercard"
2201,2204,2201,2862,"CN_TEX_Copyright"
2201,2204,2202,2896,"CN_TEX_R_mark"
2201,2204,2203,2924,"CN_TEX_TradeMark"
2201,2204,2204,2958,"CN_TEX_Dash"
3000,3000,3000,2982,"Set Xbox One Wireless Controller vibration strength."
4101,4102,4101,3088,"Cannot connect to network. Returning to Title Menu."
4101,4102,4102,3192,"The connection to the DARK SOULS Ⅲ game server was lost. Returning to title menu."
4130,4134,4130,3356,"You have disconnected from Xbox Live. Returning to title menu."
4130,4134,4131,3482,"A network error occurred. Returning to title menu."
4130,4134,4132,3584,"This profile is not authorized to connect to online mode. Returning to title menu."
4130,4134,4133,3750,"Signed out. Returning to title menu."
4130,4134,4134,3824,"Press the <?kgicon@2001?> button on the Xbox One wireless controller that will be used."
4190,4193,4190,4000,"A network error occurred. Returning to title menu."
4190,4193,4191,4102,"Failed to save game. Save data is corrupted. Select "Yes" to try again. Select "No" to return to the title screen without saving."
4190,4193,4192,4366,"Failed to save game. Save data is corrupted. Returning to title screen."
4190,4193,4193,4512,"Failed to save game. Save data is corrupted."
100000,100030,100000,4602,"RB"
100000,100030,100001,4608,"LB"
100000,100030,100010,4614,"Gamertag"
100000,100030,100011,4632,"Character name"
100000,100030,100020,4662,"Some functionality has been restricted as per parental control settings."
100000,100030,100030,4808,"Xbox One wireless controller"
100100,100100,100100,4866,"Installation progress"
101000,101000,101000,4910,"PRESS ANY BUTTON"
200100,200100,200100,4944,"Text includes unsupported characters. Unsupported characters will be replaced with asterisks (*)."
400003,400003,400003,5140,"At the end of the previous session, Quit Game might not have been selected from the system menu. Please use Quit Game from the system menu when you wish to end your play session. Failure to end session with Quit Game may result in loss of progress."
401102,401120,401102,5640,"Failed to create save data. Press "OK" to try again."
401102,401120,401103,5746,"Failed to load save data. Press "OK" to try again."
401102,401120,401106,5848,"Failed to save game. Save data is corrupted. Select "OK" to try again."
401102,401120,401107,5992,"The save data is corrupted. Delete corrupted data and create a new save?"
401102,401120,401110,6138,"Checking save data..."
401102,401120,401111,6182,"Creating save data..."
401102,401120,401112,6226,"Updating save data..."
401102,401120,401113,6270,"The game version and save data version are different. Quit the game and connect to Xbox Live to update DARK SOULS Ⅲ to the latest version."
401102,401120,401114,6548,"Cannot load this profile as it is from a later version of the currently installed game. Quit the game and sign in to Xbox Live to update DARK SOULS Ⅲ to the latest version."
401102,401120,401115,6894,"Game installation incomplete. Cannot load profiles saved to a complete install."
401102,401120,401120,7054,"Checking network connection status..."
401150,401184,401150,7130,"Logging in to the DARK SOULS Ⅲ game server..."
401150,401184,401160,7222,"Retrieving data from the DARK SOULS III game server..."
401150,401184,401165,7332,"Saving data to the DARK SOULS III game server..."
401150,401184,401170,7430,"Starting game in offline mode.  To use online features, check to see  if your connection is set up properly,  and select "Log In" from title menu."
401150,401184,401171,7726,"Returning to title menu."
401150,401184,401181,7776,"Begin play with this profile: <?gamertag?>"
401150,401184,401182,7862,"Cannot play using a guest profile. Please select an Xbox Live profile."
401150,401184,401183,8004,"The game cannot be started as you have not selected a profile. Please select a profile now."
401150,401184,401184,8188,"An error has occurred. Returning to title menu."
401201,401202,401201,8284,"Unable to connect to the network. Please check your network settings."
401201,401202,401202,8424,"Network status check failed."
401502,401510,401502,8482,"Your profile is currently not permitted to access DARK SOULS Ⅲ game server services."
401502,401510,401503,8652,"Failed to log in to the DARK SOULS Ⅲ game server. Select "OK" to attempt to log in again."
401502,401510,401504,8832,"An update to the game is available. To start in online mode,  quit the game and sign in to Xbox Live to update DARK SOULS Ⅲ to the latest version."
401502,401510,401505,9126,"Cannot log in to the DARK SOULS Ⅲ game server because it has been stopped or is undergoing maintenance."
401502,401510,401510,9334,"A network error occurred. Select "OK" to try again."
401601,401601,401601,9438,"Failed to acquire information. Select "OK" to try again."
401631,401631,401631,9552,"This profile is not authorized to access multiplayer features. Starting game in offline mode."
401701,401701,401701,9740,"Cannot create any more profiles. Delete an existing profile and create a new one? Note: You may create up to 10 profiles."
401721,401731,401721,9986,"Failed to load save data. Save data is corrupted."
401721,401731,401731,10086,"Failed to initialize character info for online mode. Select "OK" to try again."
401751,401753,401751,10246,"Retrieving latest calibrations..."
401751,401753,401752,10314,"Failed to retrieve latest calibrations. Select "OK" to try again. Select "Cancel" to start game in offline mode."
401751,401753,401753,10542,"Retrieving latest calibrations... Press "Cancel" to continue without latest."
401991,401991,401991,10696,"An error has occurred. Returning to title menu."
600000,600019,600000,10792,"DARK SOULS Ⅲ 日本リージョン向け利用規約ダミーテキスト：XboxOne：日本リージョン：英語 第１条 あいうえおかきくけこさしすせそたちつてとあいうえおかきくけこさしすせそたちつてとあいうえおかきくけこさしすせそたちつてとあいうえおかきくけこさしすせそたちつてと "
600000,600019,600001,11076,"第２条 あいうえおかきくけこさしすせそたちつてとあいうえおかきくけこさしすせそたちつてとあいうえおかきくけこさしすせそたちつてとあいうえおかきくけこさしすせそたちつてと あいうえおかきくけこさしすせそたちつてとあいうえおかきくけこさしすせそたちつてとあいうえおかきくけこさしすせそたちつてとあいうえおかきくけこさしすせそたちつてと あいうえおかきくけこさしすせそたちつてとあいうえおかきくけこさしすせそたちつてとあいうえおかきくけこさしすせそたちつてとあいうえおかきくけこさしすせそたちつてと あいうえおかきくけこさしすせそたちつてとあいうえおかきくけこさしすせそたちつてとあいうえおかきくけこさしすせそたちつてとあいうえおかきくけこさしすせそたちつてと あいうえおかきくけこさしすせそたちつてとあいうえおかきくけこさしすせそたちつてとあいうえおかきくけこさしすせそたちつてとあいうえおかきくけこさしすせそたちつてと あいうえおかきくけこさしすせそたちつてとあいうえおかきくけこさしすせそたちつてとあいうえおかきくけこさしすせそたちつてとあいうえおかきくけこさしすせそたちつてと あいうえおかきくけこさしすせそたちつてとあいうえおかきくけこさしすせそたちつてとあいうえおかきくけこさしすせそたちつてとあいうえおかきくけこさしすせそたちつてと あいうえおかきくけこさしすせそたちつてとあいうえおかきくけこさしすせそたちつてとあいうえおかきくけこさしすせそたちつてとあいうえおかきくけこさしすせそたちつてと あいうえおかきくけこさしすせそたちつてとあいうえおかきくけこさしすせそたちつてとあいうえおかきくけこさしすせそたちつてとあいうえおかきくけこさしすせそたちつてと "
601000,601023,601000,12564,"Terms and Conditions"
601000,601023,601001,12606," BANDAI NAMCO ENTERTAINMENT AMERICA INC. DARK SOULS™ III END USER LICENSE AGREEMENT IMPORTANT - READ CAREFULLY: Last Updated: December 17, 
2015 This End User License Agreement (this “EULA”) may be updated from time to time. Your continued use of the Game (as defined below) after a revised version has been communicated to you constitutes acceptance by you of its terms. THE GAME IS LICENSED TO YOU ON THE TERMS SET FORTH IN THIS EULA, WHICH CONSTITUTES A LEGAL AGREEMENT BETWEEN YOU AND BANDAI NAMCO ENTERTAINMENT AMERICA INC. (“BNEA”).  BY ACCESSING, PLAYING, INSTALLING, OR OTHERWISE USING THE GAME IN ANY WAY, YOU AGREE TO BE LEGALLY BOUND BY THE TERMS OF THIS EULA WITH BNEA. PURCHASE AND USE OF ITEMS ARE SUBJECT TO THE NETWORK TERMS OF SERVICE AND USER AGREEMENT. THIS ONLINE SERVICE HAS BEEN SUBLICENSED TO YOU BY MICROSOFT CORPORATION. YOUR USE OF THE GAME IS ALSO SUBJECT TO THE TERMS AND CONDITIONS SET FORTH IN MICROSOFT CORPORATION’S XBOX LIVE® NETWORK TERMS OF SERVICE AND MICROSOFT CORPORATION’S XBOX ON 601000,601023,601002,16738, 
1. PRECONDITIONS OF THE LICENSES.  The licenses granted in this EULA are specifically conditioned upon the following and your full compliance with all other terms and conditions set forth in this EULA: • You have reached the age of majority in your jurisdiction. If you are under the age of majority in your jurisdiction, your legal representative (e.g., a parent or a person who has parental authority) must agree on your behalf to comply, and take full responsibility for your compliance, with this EULA prior to your use of the Game;  • You agree to and comply with all of the terms in this EULA, and any additional terms as may be applicable to the Game, which acceptance is evidenced by your access to and use of the Game; • You have accepted all of the terms stipulated in Microsoft Corporation’s Xbox Live® Network Terms of Service and Microsoft Corporation’s Xbox One System Software License Agreement and/or any other terms and agreements applicable to the Hardware, as defined below, which is evidenced by your u 601000,601023,601003,19826, 
2. LIMITED USE LICENSE.  Subject to the terms of this EULA, BNEA grants you the non-exclusive, non-transferable, revocable, limited right and license to access and use one copy of the Game solely for your personal use with the Hardware.  Commercial use of the Game is prohibited.  To access and use the Game, you must have legally obtained the Game from BNEA and all Hardware and/or third-party products and services required to operate the Game and/or access any online, multi-player, or downloadable portion of the Game that BNEA does not provide.  You are responsible for paying all fees, taxes, and other costs you may incur to access and use the Game, including, but not limited to, costs for any Hardware, Internet service, or other third-party products and services required to access any multi-player, online, or downloadable portions of the Game.  Neither this EULA nor your access to or use of the Game entitles you to any future releases of the Game or any expansions, sequels, or similar or ancillary products. 601000,601023,601004,22092, 
3. VIRTUAL ITEMS. 3.1. BNEA may offer you the ability to earn a limited license to virtual goods and services made available by BNEA in the Game (collectively, “Virtual Items”).  If BNEA offers the ability to earn such licenses, BNEA hereby grants you a non-exclusive, non-transferable, revocable, limited right and license to such Virtual Items, as applicable, for your personal, non-commercial use exclusively in the Game, subject to the terms of this EULA and your compliance therewith. 3.2. You may only use Virtual Items in the Game and are not redeemable for money or monetary value from BNEA or any other person or entity, except as otherwise required by applicable law.  Virtual Items do not have an equivalent value in real currency and do not act as a substitute for real currency.  Neither BNEA nor any other person or entity has any obligation to exchange Virtual Items for anything of value, including, but not limited to, real currency.  You acknowledge and agree that BNEA may engage in actions that may imp 601000,601023,601005,25924, 
4. OWNERSHIP.  All intellectual property rights in and to the Game (including, but not limited to, video, audio, and other content incorporated therein or later downloaded) and title to any and all copies thereof are owned by BNEA or its licensors, and you receive no right or interest therein, except for the limited licenses expressly provided herein. 4.1. You may not do any of the following: • Copy the Game except for a single backup copy; • Sell, rent, lease, license, distribute, or otherwise transfer or make the Game available to any other person, in whole or in part, or use the Game or any part thereof in any commercial context, including, but not limited to, on a commercial website or in a service bureau, “cyber café,” computer gaming center, or any other commercial location in which a user may access, view, or use the Game or the Game’s elements who has not purchased or been authorized by BNEA; • Reverse engineer, derive source code, modify, decompile, disassemble, or create derivative works of the Ga 601000,601023,601006,28728, 
5. SECURITY MEASURES/PROTECTIONS. Certain security measures may be required in order for you to make full use of the Game, including, without limitation, the requirement to register the Game with a serial code, the requirement to have continuous access to the Internet, and/or the acceptance of security/digital rights management features.  Failure to accept the security measures may partially or completely impair your use of the Game."
601000,601023,601007,29608," 6. USER-GENERATED CONTENT. In exchange for access to and use of the Game and to the extent that you create content through access to and use of the Game (“User-Generated Content”), you hereby grant BNEA an exclusive, perpetual, irrevocable, royalty-free, fully transferable, and sub-licensable worldwide right and license to use User-Generated Content in any way and for any purpose in connection with the Game and related goods and services, including the rights to reproduce, copy, adapt, modify, perform, create derivative works from, display, publish, broadcast, transmit, or otherwise use, distribute, exploit, and communicate to the public by any and all means and media whether now known or hereafter devised without any further notice or compensation of any kind to you for the whole duration of protection granted to intellectual property rights by applicable laws and international conventions.  To the extent permitted by applicable law, you hereby waive any moral rights of paternity, publication, reputation,  601000,601023,601008,32252, 
7. ONLINE CONDUCT. 7.1. BNEA does not pre-screen content of postings or online chats in the Game and does not assume any responsibility or liability for User-Generated Content.  BNEA does not assume any liability for any failure to remove, or any delay in removing, User-Generated Content.  Without limiting any of its other rights and remedies under this EULA or applicable law, if BNEA objects to any User-Generated Content for any reason, BNEA, in its sole discretion may (either itself or, if applicable, by request to a third-party service provider): (a) remove the User-Generated Content; (b) give warnings to applicable persons; and/or (c) restrict, suspend, or terminate access to and use of the Game without any notice or liability.   7.2. You agree that you will be personally responsible for your access to and use of the Game, and for all of your communication and activity in connection with the Game, including any User-Generated Content.   7.3. In connection your communication and activity with the Game, y 601000,601023,601009,38746, 
8. LIMITATION ON DAMAGES.   8.1. TO THE MAXIMUM EXTENT PERMITTED BY APPLICABLE LAW, IN NO EVENT SHALL BNEA, ITS SUPPLIERS, ITS LICENSORS, OR THEIR RESPECTIVE DIRECTORS, OFFICERS, EMPLOYEES, CONTRACTORS, OR AGENTS, BE LIABLE FOR ANY SPECIAL, INCIDENTAL, INDIRECT, EXEMPLARY, PUNITIVE, OR CONSEQUENTIAL DAMAGES WHATSOEVER ARISING OUT OF THE POSSESSION OF, ACCESS TO, USE OF, OR INABILITY TO USE THE GAME, OR THE FAILURE TO PROVIDE SUPPORT SERVICES, EVEN IF A PARTY HAS BEEN ADVISED OF THE POSSIBILITY OF SUCH DAMAGES.  THIS LIMITATION WILL APPLY REGARDLESS OF THE THEORY OF LIABILITY, WHETHER FRAUD, MISREPRESENTATION, BREACH OF CONTRACT, NEGLIGENCE, PERSONAL INJURY, PRODUCTS LIABILITY, INTELLECTUAL PROPERTY INFRINGEMENT, OR ANY OTHER THEORY.  IN ANY CASE AND EXCEPT AS OTHERWISE REQUIRED BY APPLICABLE LAW, BNEA'S, ITS LICENSORS’, AND SUPPLIERS’ ENTIRE LIABILITY FOR ANY AND ALL DAMAGES UNDER THIS EULA SHALL BE LIMITED TO THE AMOUNT ACTUALLY PAID BY YOU FOR THE GAME.    8.2. BNEA AND ITS SUPPLIERS AND LICENSORS MAKE NO 601000,601023,601010,44408, 
9. TERMINATION/SUSPENSION. 9.1. This EULA is effective upon your agreement to be bound by its terms and remains in effect until terminated by you or BNEA. You may terminate this EULA at any time by deleting and destroying any and all copies of the Game in your possession, custody, or control.  9.2. Except as otherwise prohibited by applicable law, BNEA may limit, suspend, or terminate the licenses granted hereunder and your access to and use of the Game, including, but not limited to Virtual Items and any related services and products, at any time and for any reason without notice or liability to you. 9.3. Without limiting any other rights of BNEA, if you fail to comply with the terms and conditions of this EULA, BNEA retains the right, in its sole discretion, to immediately limit, suspend, or terminate your access to and/or use of the Game. 9.4. Upon termination of this EULA, your rights to access and use the Game, including any licenses and access to Virtual Items, user data, points, character progress, a 601000,601023,601011,47332, 
10. PRIVACY.  BNEA respects your privacy rights.  Any personal information supplied by you to BNEA online or via any BNEA-controlled website will be subject to the privacy policy posted at: http://www.bandainamcoent.com/company/privacy.html.  Notwithstanding what is stated in the applicable privacy policy, if you use any online services, such as online play or the downloading and uploading of content, BNEA may also collect, use, store, transmit and publicly display statistical data regarding game play (including ID, play log, play data (level, item), specifications of local machines, and residence regions), or identify content that is created and shared by you with other players."
601000,601023,601012,48714," 11. U.S. GOVERNMENT RESTRICTED RIGHTS.  The Game has been developed entirely at private expense and is provided as a “Commercial Computer Game” or “restricted computer Game.” Use, duplication, or disclosure by the U.S. Government or a U.S. Government subcontractor is subject to the restrictions set forth in subparagraph (c)(1)(ii) of the Rights in Technical Data and Computer Game clauses in DFARS 252.227-7013 or as set forth in subparagraphs (c)(1) and (2) of the Commercial Computer Game Restricted Rights clauses at FAR 52.227-19,"as applicable.  The Contractor/Manufacturer is BANDAI NAMCO Entertainment Inc., "
4-5-15 Higashi Shinagawa, Shinagawa-ku, Tokyo 140-8590.  The Developer is FromSoftware, Inc., G-PLACE Sasazuka 2-26-2 Sasazuka Shibuya-ku, Tokyo 151-0073."
601000,601023,601013,50262," 12. INJUNCTION.  Because BNEA would be irreparably damaged if the terms of this EULA were not specifically enforced, you agree that BNEA and/or its licensors and suppliers shall be entitled, without bond, other security or proof of damages, to appropriate equitable remedies with respect to breaches of this EULA, in addition to such other remedies as BNEA may otherwise have under applicable law."
601000,601023,601014,51062," 13. INDEMNITY.  You agree to indemnify, defend, and hold harmless BNEA, its licensors, its suppliers, and each of their respective officers, directors, employees, and agents from all damages, losses, and expenses, including reasonable attorneys’ fees, arising, directly or indirectly, from any violation of this EULA by you or from your acts and omissions to act in using the Game.  BNEA reserves the right to assume the exclusive defense and control of any matter subject to indemnification by you."
601000,601023,601015,52066," 14. DISPUTE RESOLUTION/BINDING ARBITRATION/CLASS ACTION WAIVER. 14.1. YOU AND BNEA AGREE TO RESOLVE ALL DISPUTES AND CLAIMS BETWEEN YOU AND BNEA IN INDIVIDUAL BINDING ARBITRATION.  THAT INCLUDES, BUT IS NOT LIMITED TO, ANY CLAIMS ARISING OUT OF OR RELATING TO: (A) ANY ASPECT OF THE RELATIONSHIP BETWEEN YOU AND BNEA; (B) THIS EULA; OR (C) YOUR ACCESS TO AND USE OF THE GAME.  IT APPLIES REGARDLESS OF WHETHER SUCH CLAIMS ARE BASED IN CONTRACT, TORT, STATUTE, FRAUD, UNFAIR COMPETITION, MISREPRESENTATION, OR ANY OTHER LEGAL THEORY. 14.2. However, this Section does not apply to the following types of claims or disputes, which you or BNEA may bring in any court with jurisdiction: (i) claims of infringement or other misuse of intellectual property rights, including such claims seeking injunctive relief; and (ii) claims related to or arising from any alleged unauthorized use, piracy, or theft. 14.3. This Section does not prevent you from bringing your dispute to the attention of any federal, state, or local governme 601000,601023,601016,62288, 
15. GOVERNING LAW.  Any dispute not subject to arbitration, or where no election to arbitrate has been made, will be decided by the state or federal court located in Santa Clara County, California, and you and BNEA agree to submit to the personal jurisdiction of that court.  Except as otherwise set forth herein, this EULA shall be governed by, and will be construed under, the laws of California and the United States of America, without regard to choice of law or conflict of law principles. The UN Convention on Contracts for the International Sale of Goods is expressly disclaimed."
601000,601023,601017,63466," 16. MISCELLANEOUS. If any provision of this EULA is held to be invalid or unenforceable, such provision shall be struck and the remaining provisions will remain in effect and be enforced as if the invalid or unenforceable provision were not contained in the EULA.  BNEA’s failure to act with respect to a breach by you or others does not waive its right to act with respect to subsequent or similar breaches.  You may not assign or transfer this EULA or your rights, and any attempt to the contrary is void.  This EULA sets forth the entire understanding and agreement between BNEA and you with respect to the subject matter."
601000,601023,601018,64722," If you have any questions concerning this EULA, you may contact BANDAI NAMCO Entertainment America Inc.’s customer service at http://www.bandainamcoent.com/company/support.html or at BANDAI NAMCO Entertainment America Inc., 
2051 Mission College Boulevard, Santa Clara, California 95054,"USA.""
602000,602023,602000,65310," BANDAI NAMCO ENTERTAINMENT EUROPE DARK SOULS™ Ⅲ END USER LICENSE AGREEMENT (“EULA”) IMPORTANT - READ CAREFULLY:   This End User License Agreement (“EULA”) may be updated from time to time. Your continued use of this software after a revised version has been posted or communicated to you constitutes acceptance by you of its terms. THE BANDAI NAMCO ENTERTAINMENT VIDEO GAME YOU ARE USING (WHICH INCLUDES COMPUTER GAME, MEDIA, AND RELATED DOCUMENTATION IN PRINTED OR ELECTRONIC FORM) IS LICENSED TO YOU ON THE TERMS SET FORTH BELOW, WHICH CONSTITUTES A LEGAL AGREEMENT BETWEEN YOU AND BANDAI NAMCO ENTERTAINMENT EUROPE ("BNEE").  BY PLAYING THE VIDEO GAME (EITHER ON YOUR HOME CONSOLE OR ONLINE), AND/OR INSTALLING OR OTHERWISE USING THE GAME PROGRAM, YOU AGREE TO BE LEGALLY BOUND BY THE TERMS OF THIS AGREEMENT WITH BNEE. The Dark Souls Ⅲ Version, including without limitation any multi-player, online or downloadable portions thereof (the “Game”) is protected by the copyright laws of France, international copyright 602000,602023,602001,68198, 
